{
  "runId": "run-2026-08-25-001",
  "environment": "UAT",
  "requestedTiers": [
    "global_contract"
  ],
  "apis": [
    {
      "ref": "get|/user/leaves/getallleavereports|leave api|tc01/tc03 - get all leave reports and validate structure",
      "credentialAlias": "leave-svc-uat-01",
      "authProviderApiId": "post|/auth/token|employee auth api|tc01 - valid credentials return jwt token"
    },
    {
      "ref": "get|/api/attendancepolicy|attendance policy master|get all policies",
      "credentialAlias": "attendance-svc-uat-01",
      "authProviderApiId": "post|/auth/token|login auth uat api|tc01 - valid credentials return token"
    }
  ]
}
