{
  "runId": "s01-leave-single",
  "environment": "UAT",
  "requestedTiers": [
    "global_contract"
  ],
  "apis": [
    {
      "ref": "get|/user/leaves/getallleavereports|leave api|tc01/tc03 - get all leave reports and validate structure",
      "credentialAlias": "leave-svc-uat-01",
      "authProviderApiId": "post|/auth/token|employee auth api|tc01 - valid credentials return jwt token"
    }
  ]
}
