{"runId": "full-audit", "environment": "UAT", "requestedTiers": ["global_contract"], "apis": [{"ref": "delete|/api/attendance/holiday-templates/delete/{holidaytemplateid}|holiday template apis copy|delete", "credentialAlias": "attendance-svc-uat-01"}, {"ref": "delete|/api/attendance/status-thresholds/delete/1|attendance status threshold api|delete threshold", "credentialAlias": "attendance-svc-uat-01"}, {"ref": "delete|/api/attendancepolicy/2|attendance policy master|delete policy by id", "credentialAlias": "attendance-svc-uat-01"}, {"ref": "delete|/api/v1/attendance/shift/master/6|attendance shift master|delete shift", "credentialAlias": "attendance-svc-uat-01"}, {"ref": "get|/api/attendance/holiday-templates/getall|holiday template apis copy|get all", "credentialAlias": "attendance-svc-uat-01"}, {"ref": "get|/api/attendance/holiday-templates/getbyid/19|holiday template apis copy|get by id", "credentialAlias": "attendance-svc-uat-01"}, {"ref": "get|/api/attendance/late-early-policies/getall|latearly-policy|getall", "credentialAlias": "attendance-svc-uat-01"}, {"ref": "get|/api/attendance/late-early-policies/getbyid/5|latearly-policy|getbyid/1", "credentialAlias": "attendance-svc-uat-01"}, {"ref": "get|/api/attendance/status-threshold/getall|attendance status threshold api|get all", "credentialAlias": "attendance-svc-uat-01"}, {"ref": "get|/api/attendance/status-threshold/getbyid/8|attendance status threshold api|get by id", "credentialAlias": "attendance-svc-uat-01"}, {"ref": "get|/api/attendance/week-offs/getall|attenedance-july2026|weekoffgetall", "credentialAlias": "attendance-svc-uat-01"}, {"ref": "get|/api/attendance/week-offs/getbyid/1|attenedance-july2026|weekoffgetbyid", "credentialAlias": "attendance-svc-uat-01"}, {"ref": "get|/api/attendancepolicy/1|attendance policy master|get policy by id", "credentialAlias": "attendance-svc-uat-01"}, {"ref": "get|/api/attendancepolicy|attendance policy master|get all policies", "credentialAlias": "attendance-svc-uat-01"}, {"ref": "get|/api/v1/attendance/shift/master/7|attendance shift master|get by id", "credentialAlias": "attendance-svc-uat-01"}, {"ref": "get|/api/v1/attendance/shift/master|attendance shift master|get all shifts", "credentialAlias": "attendance-svc-uat-01"}, {"ref": "get|/user/leaves/getallleavereports|leave api|tc01/tc03 - get all leave reports and validate structure", "credentialAlias": "attendance-svc-uat-01"}, {"ref": "get|/user/leaves/getallleavereports|leave api|tc02 - invalid token returns observed authorization status", "credentialAlias": "attendance-svc-uat-01"}, {"ref": "get|/users/me|users|get profile", "credentialAlias": "attendance-svc-uat-01"}, {"ref": "patch|/api/attendance/holiday-templates/19/status|holiday template apis copy|change status", "credentialAlias": "attendance-svc-uat-01"}, {"ref": "patch|/api/attendance/late-early-policies/5/status|latearly-policy|changestatus", "credentialAlias": "attendance-svc-uat-01"}, {"ref": "patch|/api/attendance/status-threshold/1/status|attendance status threshold api|change status", "credentialAlias": "attendance-svc-uat-01"}, {"ref": "patch|/api/attendance/week-off-assignment/changestatus|attenedance-july2026|week-off-assignment/changestatus", "credentialAlias": "attendance-svc-uat-01"}, {"ref": "patch|/api/attendance/week-offs/actdeact/3/status|attenedance-july2026|weekoffactdeact", "credentialAlias": "attendance-svc-uat-01"}, {"ref": "patch|/api/attendancepolicy/4/status|attendance policy master|activate deactivate", "credentialAlias": "attendance-svc-uat-01"}, {"ref": "patch|/api/v1/attendance/shift/master/status/7|attendance shift master|toggle delete", "credentialAlias": "attendance-svc-uat-01"}, {"ref": "post|/api/attendance/holiday-templates/create|holiday template apis copy|create", "credentialAlias": "attendance-svc-uat-01"}, {"ref": "post|/api/attendance/late-early-policies/create|latearly-policy|create", "credentialAlias": "attendance-svc-uat-01"}, {"ref": "post|/api/attendance/status-threshold/create|attendance status threshold api|create threshold", "credentialAlias": "attendance-svc-uat-01"}, {"ref": "post|/api/attendance/week-off-assignment/getbyweekoff|attenedance-july2026|week-off-assignment/getbyweekoffid", "credentialAlias": "attendance-svc-uat-01"}, {"ref": "post|/api/attendance/week-offs/create|attenedance-july2026|weekoffmastercreate", "credentialAlias": "attendance-svc-uat-01"}, {"ref": "post|/api/attendancepolicy|attendance policy master|create new policy", "credentialAlias": "attendance-svc-uat-01"}, {"ref": "post|/api/v1/attendance/shift/master|attendance shift master|create custom shift (fixed type)", "credentialAlias": "attendance-svc-uat-01"}, {"ref": "post|/api/v1/attendance/shift/master|attendance shift master|create new shift", "credentialAlias": "attendance-svc-uat-01"}, {"ref": "post|/auth/token|auth|login", "credentialAlias": "attendance-svc-uat-01"}, {"ref": "post|/auth/token|employee auth api|tc01 - valid credentials return jwt token", "credentialAlias": "attendance-svc-uat-01"}, {"ref": "post|/auth/token|employee auth api|tc02 - invalid empcode returns 400", "credentialAlias": "attendance-svc-uat-01"}, {"ref": "post|/auth/token|employee auth api|tc03 - missing password returns 400", "credentialAlias": "attendance-svc-uat-01"}, {"ref": "post|/auth/token|login auth uat api|tc01 - valid credentials return token", "credentialAlias": "attendance-svc-uat-01"}, {"ref": "put|/api/attendance/holiday-templates/update/{holidaytemplateid}|holiday template apis copy|update", "credentialAlias": "attendance-svc-uat-01"}, {"ref": "put|/api/attendance/late-early-policies/update/2|latearly-policy|update", "credentialAlias": "attendance-svc-uat-01"}, {"ref": "put|/api/attendance/status-threshold/update/1|attendance status threshold api|update threshold", "credentialAlias": "attendance-svc-uat-01"}, {"ref": "put|/api/attendance/week-offs/update/1|attenedance-july2026|weekoffupdate", "credentialAlias": "attendance-svc-uat-01"}, {"ref": "put|/api/attendancepolicy/2|attendance policy master|update policy by id", "credentialAlias": "attendance-svc-uat-01"}, {"ref": "put|/api/v1/attendance/shift/master/2|attendance shift master|update shift", "credentialAlias": "attendance-svc-uat-01"}]}