{
  "runId": "s02-attendance-single",
  "environment": "UAT",
  "requestedTiers": [
    "global_contract"
  ],
  "apis": [
    {
      "ref": "get|/api/attendancepolicy|attendance policy master|get all policies",
      "credentialAlias": "attendance-svc-uat-01",
      "authProviderApiId": "post|/auth/token|login auth uat api|tc01 - valid credentials return token"
    }
  ]
}
